{
  "$schema": "https://json-schema.org/draft/2020-12/schema",
  "$id": "https://agentpass.dev/contracts/schemas/platform-session-http-assertion-response-v1.schema.json",
  "title": "AgentPass platform session assertion HTTP response v1",
  "description": "The public JSON response after WebAuthn assertion verification. The bearer is transported only by the required HttpOnly cookie; the CSRF token is intentionally returned in JSON for the matching header on self-revoke.",
  "type": "object",
  "additionalProperties": false,
  "minProperties": 3,
  "maxProperties": 4,
  "required": ["session", "challenge_id", "csrf_token"],
  "properties": {
    "session": { "$ref": "https://agentpass.dev/contracts/schemas/platform-session-response-v1.schema.json" },
    "challenge_id": { "$ref": "#/$defs/uuid" },
    "csrf_token": { "type": "string", "minLength": 43, "maxLength": 43, "pattern": "^[A-Za-z0-9_-]{43}$" },
    "authenticated_at": { "$ref": "#/$defs/timestamp" }
  },
  "$defs": {
    "uuid": { "type": "string", "format": "uuid", "pattern": "^[0-9a-f]{8}-[0-9a-f]{4}-[1-8][0-9a-f]{3}-[89ab][0-9a-f]{3}-[0-9a-f]{12}$" },
    "timestamp": { "type": "string", "format": "date-time", "minLength": 24, "maxLength": 24, "pattern": "^\\d{4}-\\d{2}-\\d{2}T\\d{2}:\\d{2}:\\d{2}\\.\\d{3}Z$" }
  }
}
